DATA_KEY,SERIES_NAME,SERIES_NAME_SHORT,QUANTITY,ORIG_UNIT,INFO,OWNER,SOURCE,DATA_TYPE,SQL_DOMAIN_CODE,SQL_ELEMENT_CODE,SQL_ITEM_CODE,WDINAME,COMMENTS,TOPIC
QC.YIELD.OILCRPS.HG.GR11,Oil-bearing crop yield annual growth (percent),Oil-bearing crops yield,,percent,,,"FAO, Statistics Division (FAOSTAT)",processed,,,,,,"oilcrops, production"
QC.PRD.PULSE.TN.NO,Pulse production (tonnes),Pulses production,,tonnes,See 'Pulses' and 'Crop production'.,FAO,"FAO, Statistics Division (FAOSTAT)",raw,QC,5510,1726,,,"pulses, production"
QC.PRD.PULSE.TN.SHP,Pulse production per capita (tonne/cap),Pulses production,,tonne/cap,,,"FAO, Statistics Division (FAOSTAT)",processed,,,,,,"pulses, production"
QC.PRD.PULSE.TN.GR10,Pulse production annual growth (percent),Pulses production,,percent,,,"FAO, Statistics Division (FAOSTAT)",processed,,,,,,"pulses, production"
QC.PRD.PULSE.TN.GR11,Pulse production annual growth (percent),Pulses production,,percent,,,"FAO, Statistics Division (FAOSTAT)",processed,,,,,,"pulses, production"
QC.RHRV.PULSE.HA.NO,Pulse harvested area (ha),Pulses harvested area,,ha,See 'Pulses' and 'Crop area'.,FAO,"FAO, Statistics Division (FAOSTAT)",raw,QC,5312,1726,,,"pulses, production"
QC.RHRV.PULSE.HA.GR10,Pulse harvested area annual growth (percent),Pulses harvested area,,percent,,,"FAO, Statistics Division (FAOSTAT)",processed,,,,,,"pulses, production"
QC.RHRV.PULSE.HA.GR11,Pulse harvested area annual growth (percent),Pulses harvested area,,percent,,,"FAO, Statistics Division (FAOSTAT)",processed,,,,,,"pulses, production"
QC.YIELD.PULSE.HG.NO,Pulse yield (hg/ha),Pulses yield,,hg/ha,See 'Pulses' and 'Crop yield'.,FAO,"FAO, Statistics Division (FAOSTAT)",raw,QC,5419,1726,,,"pulses, production"
QC.YIELD.PULSE.HG.GR10,Pulse yield annual growth (percent),Pulses yield,,percent,,,"FAO, Statistics Division (FAOSTAT)",processed,,,,,,"pulses, production"
QC.YIELD.PULSE.HG.GR11,Pulse yield annual growth (percent),Pulses yield,,percent,,,"FAO, Statistics Division (FAOSTAT)",processed,,,,,,"pulses, production"
QC.PRD.RTTB.TN.NO,Root and tuber production (tonnes),Root and tuber crops production,,tonnes,See 'Root and tuber crops' and 'Crop production'.,FAO,"FAO, Statistics Division (FAOSTAT)",raw,QC,5510,1720,,,"root and tuber crops, production"
QC.PRD.RTTB.TN.SHW,"Root and tuber production, share of world total",Root and tuber crops production,,percent,,,"FAO, Statistics Division (FAOSTAT)",processed,,,,,,
QC.PRD.RTTB.TN.SHP,Root and tuber production per capita(tonne/cap),Root and tuber crops production,,tonne/cap,,,"FAO, Statistics Division (FAOSTAT)",processed,,,,,,"root and tuber crops, production"
QC.PRD.RTTB.TN.GR10,Root and tuber production annual growth (percent),Roots and tubers production,,percent,,,"FAO, Statistics Division (FAOSTAT)",processed,,,,,,"root and tuber crops, production"
QC.PRD.RTTB.TN.GR11,Root and tuber production annual growth (percent),Roots and tubers production,,percent,,,"FAO, Statistics Division (FAOSTAT)",processed,,,,,,"root and tuber crops, production"
QC.RHRV.RTTB.HA.NO,Root and tuber harvested area (ha),Roots and tubers harvested area,,ha,See 'Root and tuber crops' and 'Crop area'.,FAO,"FAO, Statistics Division (FAOSTAT)",raw,QC,5312,1720,,,"root and tuber crops, production"
QC.RHRV.RTTB.HA.SHW,"Root and tuber  area, share of world area",Roots and tubers harvested area,,percent,,,"FAO, Statistics Division",processed,,,,,,"root and tuber crops, production"
QC.RHRV.RTTB.HA.SHL,"Root and tuber  area, share of agricultural land",Roots and tubers harvested area,,percent,,,"FAO, Statistics Division (FAOSTAT)",processed,,,,,,"root and tuber crops, production"
QC.RHRV.RTTB.HA.GR10,Root and tuber harvested area annual growth (percent),Roots and tubers harvested area,,percent,,,"FAO, Statistics Division (FAOSTAT)",processed,,,,,,"root and tuber crops, production"
QC.RHRV.RTTB.HA.GR11,Root and tuber harvested area annual growth (percent),Roots and tubers harvested area,,percent,,,"FAO, Statistics Division (FAOSTAT)",processed,,,,,,"root and tuber crops, production"
QC.YIELD.RTTB.HG.NO,Root and tuber yield (hg/ha),Roots and tubers yield,,hg/ha,See 'Root and tuber crops' and 'Crop yield'.,FAO,"FAO, Statistics Division (FAOSTAT)",raw,QC,5419,1720,,,"root and tuber crops, production"
QC.YIELD.RTTB.HG.GR10,Root and tuber yield annual growth (percent),Roots and tubers yield,,percent,,,"FAO, Statistics Division (FAOSTAT)",processed,,,,,,"root and tuber crops, production"
QC.YIELD.RTTB.HG.GR11,Root and tuber yield annual growth (percent),Roots and tubers yield,,percent,,,"FAO, Statistics Division (FAOSTAT)",processed,,,,,,"root and tuber crops, production"
QC.PRD.VEG.TN.NO,Vegetable production (tonnes),Vegetable production,,tonnes,"See 'Vegetable, including melons' and 'Crop production'.",FAO,"FAO, Statistics Division (FAOSTAT)",raw,QC,5510,1800,,,"vegetable, production"
QC.PRD.VEG.TN.SHW,"Vegetable production, share of world production",Vegetable production,,percent,,,"FAO, Statistics Division (FAOSTAT)",processed,,,,,,
QC.PRD.VEG.TN.SHP,"Vegetable production per capita, including melons (tonne/cap)",Vegetable production,,tonne/cap,,,"FAO, Statistics Division (FAOSTAT)",processed,,,,,,"vegetable, production"
QC.PRD.VEG.TN.GR10,Vegetable production annual growth (percent),Vegetables production,,percent,,,"FAO, Statistics Division (FAOSTAT)",processed,,,,,,"vegetable, production"
QC.PRD.VEG.TN.GR11,Vegetable production annual growth (percent),Vegetables production,,percent,,,"FAO, Statistics Division (FAOSTAT)",processed,,,,,,"vegetable, production"
QC.RHRV.VEG.HA.NO,Vegetable harvested area (ha),Vegetables harvested area,,ha,"See 'Vegetable, including melons' and 'Crop area'.",FAO,"FAO, Statistics Division (FAOSTAT)",raw,QC,5312,1800,,,"vegetable, production"
QC.RHRV.VEG.HA.SHW,"Vegetable harvested area, share of world area (percent)",Vegetables harvested area,,percent,,,"FAO, Statistics Division (FAOSTAT)",processed,,,,,,"vegetable, production"
QC.RHRV.VEG.HA.SHL,"Vegetable harvested area, share of agricultural area (percent)",Vegetables harvested area,,percent,,,"FAO, Statistics Division (FAOSTAT)",processed,,,,,,"vegetable, production"
QC.RHRV.VEG.HA.GR10,Vegetable harvested area annual growth (percent),Vegetables harvested area,,percent,,,"FAO, Statistics Division (FAOSTAT)",processed,,,,,,"vegetable, production"
QC.RHRV.VEG.HA.GR11,Vegetable harvested area annual growth (percent),Vegetables harvested area,,percent,,,"FAO, Statistics Division (FAOSTAT)",processed,,,,,,"vegetable, production"
QC.YIELD.VEG.HG.NO,Vegetable yield (hg/ha),Vegetables yield,,hg/ha,"See 'Vegetable, including melons' and 'Crop yield'.",FAO,"FAO, Statistics Division (FAOSTAT)",raw,QC,5419,1800,,,"vegetable, production"
QC.YIELD.VEG.HG.GR10,Vegetable yield annual growth (percent),Vegetables yield,,percent,,,"FAO, Statistics Division (FAOSTAT)",processed,,,,,,"vegetable, production"
QC.YIELD.VEG.HG.GR11,Vegetable yield annual growth (percent),Vegetables yield,,percent,,,"FAO, Statistics Division (FAOSTAT)",processed,,,,,,"vegetable, production"
QC.PRD.SU.TN.NO,Sugar production (tonnes),Sugar production,,tonnes,See 'Sugar' and 'Crop production'.,FAO,"FAO, Statistics Division (FAOSTAT)",raw,QC,5510,157,,,"sugar, production"
QC.PRD.SU.TN.SHW,"Sugar production, share of world production (percent)",Sugar production,,percent,,,"FAO, Statistics Division (FAOSTAT)",processed,,,,,,"sugar, production"
QC.PRD.SU.TN.SHP,Sugar production per capita (tonne/cap),Sugar production,,tonne/cap,,,"FAO, Statistics Division (FAOSTAT)",processed,,,,,,"sugar, production"
QC.PRD.SU.TN.GR10,Sugar production annual growth (percent),Sugar production,,percent,,,"FAO, Statistics Division (FAOSTAT)",processed,,,,,,"sugar, production"
QC.PRD.SU.TN.GR11,Sugar production annual growth (percent),Sugar production,,percent,,,"FAO, Statistics Division (FAOSTAT)",processed,,,,,,"sugar, production"
QC.RHRV.SU.HA.NO,Sugar harvested area (ha),Sugar harvested area,,ha,See 'Sugar' and 'Crop area'.,FAO,"FAO, Statistics Division (FAOSTAT)",raw,QC,5312,157,,,"sugar, production"
QC.RHRV.SU.HA.SHW,"Sugar harvested area, share of world area (percent)",Sugar harvested area,,percent,,,"FAO, Statistics Division (FAOSTAT)",processed,,,,,,"sugar, production"
QC.RHRV.SU.HA.SHL,"Sugar harvested area, share of agricultural area (percent)",Sugar harvested area,,percent,,,"FAO, Statistics Division (FAOSTAT)",processed,,,,,,"sugar, production"
QC.RHRV.SU.HA.GR10,Sugar harvested area annual growth (percent),Sugar harvested area,,percent,,,"FAO, Statistics Division (FAOSTAT)",processed,,,,,,"sugar, production"
QC.RHRV.SU.HA.GR11,Sugar harvested area annual growth (percent),Sugar harvested area,,percent,,,"FAO, Statistics Division (FAOSTAT)",processed,,,,,,"sugar, production"
QC.YIELD.SU.HG.NO,Sugar yield (hg/ha),Sugar yield,,hg/ha,See 'Sugar' and 'Crop yield'.,FAO,"FAO, Statistics Division (FAOSTAT)",raw,QC,5419,157,,,"sugar, production"
QC.YIELD.SU.HG.GR10,Sugar yield annual growth (percent),Sugar yield,,percent,,,"FAO, Statistics Division (FAOSTAT)",processed,,,,,,"sugar, production"
QC.YIELD.SU.HG.GR11,Sugar yield annual growth (percent),Sugar yield,,percent,,,"FAO, Statistics Division (FAOSTAT)",processed,,,,,,"sugar, production"
QC.PRD.TN.TN.NO,Treenut production (tonnes),Treenuts production,,tonnes,See 'Treenuts' and 'Crop production'.,FAO,"FAO, Statistics Division (FAOSTAT)",raw,QC,5510,1729,,,"treenuts, production"
QC.PRD.TN.TN.SHP,Treenut production per capita(tonne/cap),Treenuts production,,tonne/cap,,,"FAO, Statistics Division (FAOSTAT)",processed,,,,,,"treenuts, production"
QC.PRD.TN.TN.GR10,Treenut production annual growth (percent),Treenuts production,,percent,,,"FAO, Statistics Division (FAOSTAT)",processed,,,,,,"treenuts, production"
QC.PRD.TN.TN.GR11,Treenut production annual growth (percent),Treenuts production,,percent,,,"FAO, Statistics Division (FAOSTAT)",processed,,,,,,"treenuts, production"
QC.RHRV.TN.HA.NO,Treenut harvested area (ha),Treenuts harvested area,,ha,See 'Treenuts' and 'Crop area'.,FAO,"FAO, Statistics Division (FAOSTAT)",raw,QC,5312,1729,,,"treenuts, production"
QC.RHRV.TN.HA.GR10,Treenut harvested area annual growth (percent),Treenuts harvested area,,percent,,,"FAO, Statistics Division (FAOSTAT)",processed,,,,,,"treenuts, production"
QC.RHRV.TN.HA.GR11,Treenut harvested area annual growth (percent),Treenuts harvested area,,percent,,,"FAO, Statistics Division (FAOSTAT)",processed,,,,,,"treenuts, production"
QC.YIELD.TN.HG.NO,Treenut yield (hg/ha),Treenuts yield,,hg/ha,See 'Treenuts' and 'Crop yield'.,FAO,"FAO, Statistics Division (FAOSTAT)",raw,QC,5419,1729,,,"treenuts, production"
QC.YIELD.TN.HG.GR10,Treenut yield annual growth (percent),Treenuts yield,,percent,,,"FAO, Statistics Division (FAOSTAT)",processed,,,,,,"treenuts, production"
QC.YIELD.TN.HG.GR11,Treenut yield annual growth (percent),Treenuts yield,,percent,,,"FAO, Statistics Division (FAOSTAT)",processed,,,,,,"treenuts, production"
QC.PRD.FRU.TN.NO,"Fruit production, excluding melons (tonnes)",Fruit production,,tonnes,"See 'Fruit, excluding melons' and 'Crop production'.",FAO,"FAO, Statistics Division (FAOSTAT)",raw,QC,5510,1801,,,"fruit, production"
QC.PRD.FRU.TN.SHW,"Fruit production, share of world total",Fruit production,,percent,,,"FAO, Statistics Division",processed,,,,,,"fruit, production"
QC.PRD.FRU.TN.SHP,"Fruit production, excluding melons (tonne/cap)",Fruit production,,tonne/cap,,,"FAO, Statistics Division ",processed,,,,,,"fruit, production"
QC.PRD.FRU.TN.GR10,Fruit production annual growth (percent),Fruit production,,percent,,,"FAO, Statistics Division",processed,,,,,,"fruit, production"
QC.PRD.FRU.TN.GR11,Fruit production annual growth (percent),Fruit production,,percent,,,"FAO, Statistics Division (FAOSTAT)",processed,,,,,,"fruit, production"
QC.RHRV.FRU.HA.NO,Fruit harvested area (ha),Fruit harvested area,,ha,"See 'Fruit, excluding melons' and 'Crop area'.",FAO,"FAO, Statistics Division (FAOSTAT)",raw,QC,5312,1801,,,"fruit, production"
QC.RHRV.FRU.HA.SHW,"Fruit harvested area, share of world area (percent)",Fruit harvested area,,percent,,,"FAO, Statistics Division (FAOSTAT)",processed,,,,,,"fruit, production"
QC.RHRV.FRU.HA.SHL,"Fruit harvested area, share of agricultural area (percent)",Fruit harvested area,,percent,,,"FAO, Statistics Division (FAOSTAT)",processed,,,,,,"fruit, production"
QC.RHRV.FRU.HA.GR10,Fruit harvested area annual growth (percent),Fruit harvested area,,percent,,,"FAO, Statistics Division ",processed,,,,,,"fruit, production"
QC.RHRV.FRU.HA.GR11,Fruit harvested area annual growth (percent),Fruit harvested area,,percent,,,"FAO, Statistics Division",processed,,,,,,"fruit, production"
QC.YIELD.FRU.HG.NO,Fruit yield (hg/ha),Fruit yield,,hg/ha,"See 'Fruit, excluding melons' and 'Crop yield'.",FAO,"FAO, Statistics Division (FAOSTAT)",raw,QC,5419,1801,,,"fruit, production"
QC.YIELD.FRU.HG.GR10,Fruit yield annual growth (percent),Fruit yield,,percent,,,"FAO, Statistics Division",processed,,,,,,"fruit, production"
QC.YIELD.FRU.HG.GR11,Fruit yield annual growth (percent),Fruit yield,,percent,,,"FAO, Statistics Division",processed,,,,,,"fruit, production"
QC.PRD.CIFRU.TN.NO,Citrus fruit production (tonnes),Citrus fruit production,,tonnes,"See 'Fruit, citrus nes' and 'Crop production'.",FAO,"FAO, Statistics Division (FAOSTAT)",raw,QC,5510,1804,,,"citrus fruit, production"
QC.PRD.CIFRU.TN.SHP,Citrus fruit production per capita (tonne/cap),Citrus fruit production,,tonne/cap,,,"FAO, Statistics Division ",processed,,,,,,"citrus fruit, production"
QC.PRD.CIFRU.TN.GR10,Citrus fruit production annual growth (percent),Citrus fruit production,,percent,,,"FAO, Statistics Division",processed,,,,,,"citrus fruit, production"
QC.PRD.CIFRU.TN.GR11,Citrus fruit production annual growth (percent),Citrus fruit production,,percent,,,"FAO, Statistics Division",processed,,,,,,"citrus fruit, production"
QC.RHRV.CIFRU.HA.NO,Citrus fruit harvested area (ha),Citrus fruit harvested area,,ha,"See 'Fruit, citrus nes' and 'Crop area'.",FAO,"FAO, Statistics Division (FAOSTAT)",raw,QC,5312,1804,,,"citrus fruit, production"
QC.RHRV.CIFRU.HA.GR10,Citrus fruit harvested area annual growth (percent),Citrus fruit harvested area,,percent,,,"FAO, Statistics Division (FAOSTAT)",processed,,,,,,"citrus fruit, production"
QC.RHRV.CIFRU.HA.GR11,Citrus fruit harvested area annual growth (percent),Citrus fruit harvested area,,percent,,,"FAO, Statistics Division (FAOSTAT)",processed,,,,,,"citrus fruit, production"
QC.YIELD.CIFRU.HG.NO,Citrus fruit yield (hg/ha),Citrus fruit yield,,hg/ha,"See 'Fruit, citrus nes' and 'Crop yield'.",FAO,"FAO, Statistics Division (FAOSTAT)",raw,QC,5419,1804,,,"citrus fruit, production"
QC.YIELD.CIFRU.HG.GR10,Citrus fruit yield annual growth (percent),Citrus fruit yield,,percent,,,"FAO, Statistics Division (FAOSTAT)",processed,,,,,,"citrus fruit, production"
QC.YIELD.CIFRU.HG.GR11,Citrus fruit yield annual growth (percent),Citrus fruit yield,,percent,,,"FAO, Statistics Division (FAOSTAT)",processed,,,,,,"citrus fruit, production"
QC.PRD.FC.TN.NO,Fibre crop production (tonnes),Fibre crops production,,tonnes,See 'Fibre crops' and 'Crop production'.,FAO,"FAO, Statistics Division (FAOSTAT)",raw,QC,5510,1753,,,"fibre crops, production"
QC.PRD.FC.TN.SHP,Fibre crop production per capita (tonne/cap),Fibre crops production,,tonne/cap,,,"FAO, Statistics Division (FAOSTAT)",processed,,,,,,"fibre crops, production"
QC.PRD.FC.TN.GR10,Fibre crop production annual growth (percent),Fibre crop production,,percent,,,"FAO, Statistics Division (FAOSTAT)",processed,,,,,,"fibre crops, production"
QC.PRD.FC.TN.GR11,Fibre crop production annual growth (percent),Fibre crop production,,percent,,,"FAO, Statistics Division (FAOSTAT)",processed,,,,,,"fibre crops, production"
QC.RHRV.FC.HA.NO,Fibre crop harvested area (ha),Fibre crop harvested area,,ha,See 'Fibre crops' and 'Crop area'.,FAO,"FAO, Statistics Division (FAOSTAT)",raw,QC,5312,1753,,,"fibre crops, production"
QC.RHRV.FC.HA.GR10,Fibre crop harvested area annual growth (percent),Fibre crop harvested area,,percent,,,"FAO, Statistics Division (FAOSTAT)",processed,,,,,,"fibre crops, production"
QC.RHRV.FC.HA.GR11,Fibre crop harvested area annual growth (percent),Fibre crop harvested area,,percent,,,"FAO, Statistics Division (FAOSTAT)",processed,,,,,,"fibre crops, production"
QC.YIELD.FC.HG.NO,Fibre crop yield (hg/ha),Fibre crop yield,,hg/ha,See 'Fibre crops' and 'Crop yield'.,FAO,"FAO, Statistics Division (FAOSTAT)",raw,QC,5419,1753,,,"fibre crops, production"
QC.YIELD.FC.HG.GR10,Fibre crop yield annual growth (percent),Fibre crop yield,,percent,,,"FAO, Statistics Division (FAOSTAT)",processed,,,,,,"fibre crops, production"
QC.YIELD.FC.HG.GR11,Fibre crop yield annual growth (percent),Fibre crop yield,,percent,,,"FAO, Statistics Division (FAOSTAT)",processed,,,,,,"fibre crops, production"
QC.PRD.JJ.TN.NO,Jute and jute-like production (tonnes),Jute and jute-like production,,tonnes,See 'Jute and jute-like' and 'Crop production'.,FAO,"FAO, Statistics Division (FAOSTAT)",raw,QC,5510,1751,,,"jute and jute-like, production"
QC.PRD.JJ.TN.SHP,Jute and jute-like production per capita (tonne/cap),Jute and jute-like production,,tonne/cap,,,"FAO, Statistics Division (FAOSTAT)",processed,,,,,,"jute and jute-like, production"
QC.PRD.JJ.TN.GR10,Jute and jute-like production annual growth (percent),Jute and jute-like production,,percent,,,"FAO, Statistics Division (FAOSTAT)",processed,,,,,,"jute and jute-like, production"
QC.PRD.JJ.TN.GR11,Jute and jute-like production annual growth (percent),Jute and jute-like production,,percent,,,"FAO, Statistics Division (FAOSTAT)",processed,,,,,,"jute and jute-like, production"
QC.RHRV.JJ.HA.NO,Jute and jute-like harvested area (ha),Jute and jute-like harvested area,,ha,See 'Jute and jute-like' and 'Crop area'.,FAO,"FAO, Statistics Division (FAOSTAT)",raw,QC,5312,1751,,,"jute and jute-like, production"
QC.RHRV.JJ.HA.GR10,Jute and jute-like harvested area annual growth (percent),Jute and jute-like harvested area,,percent,,,"FAO, Statistics Division (FAOSTAT)",processed,,,,,,"jute and jute-like, production"
QC.RHRV.JJ.HA.GR11,Jute and jute-like harvested area annual growth (percent),Jute and jute-like harvested area,,percent,,,"FAO, Statistics Division (FAOSTAT)",processed,,,,,,"jute and jute-like, production"
QC.YIELD.JJ.HG.NO,Jute and jute-like yield (hg/ha),Jute and jute-like yield,,hg/ha,See 'Jute and jute-like' and 'Crop yield'.,FAO,"FAO, Statistics Division (FAOSTAT)",raw,QC,5419,1751,,,"jute and jute-like, production"
QC.YIELD.JJ.HG.GR10,Jute and jute-like yield annual growth (percent),Jute and jute-like yield,,percent,,,"FAO, Statistics Division (FAOSTAT)",processed,,,,,,"jute and jute-like, production"
QC.YIELD.JJ.HG.GR11,Jute and jute-like yield annual growth (percent),Jute and jute-like yield,,percent,,,"FAO, Statistics Division (FAOSTAT)",processed,,,,,,"jute and jute-like, production"
QA.STCK.CB.HD.NO,Cattle and buffaloes (heads),Cattle and buffaloes,,heads,See 'Cattle' and 'Buffaloes'.,FAO,"FAO, Statistics Division (FAOSTAT)",raw,QA,5111,1746,,,"cattle and buffaloes, production"
QA.STCK.CB.HD.SHW,"Cattle and buffaloes, share of world",Cattle and buffaloes,,percent,,,"FAO, Statistics Division",processed,,,,,,"cattle and buffaloes, production"
QA.STCK.CB.HD.SHL,Cattle and buffaloes per ha of agricultural area (head/ha),Cattle and buffaloes,,head/ha,,,"FAO, Statistics Division (FAOSTAT)",processed,,,,,,"cattle and buffaloes, production"
QA.STCK.CB.HD.GR11,Cattle and buffaloes annual growth (percent),Cattle and buffaloes,,percent,,,"FAO, Statistics Division (FAOSTAT)",processed,,,,,,"cattle and buffaloes, production"
QA.STCK.SG.HD.NO,Sheep and goats (heads),Sheep and goats,,heads,See 'Sheep' and 'Goats'.,FAO,"FAO, Statistics Division (FAOSTAT)",raw,QA,5111,1749,,,"sheep and goats, production"
QA.STCK.SG.HD.SHW,"Sheep and goats, share of world total",Sheep and goats,,percent,,,"FAO, Statistics Division",processed,,,,,,"sheep and goats, production"
QA.STCK.SG.HD.SHL,Sheep and goats per ha of agricultural area (head/ha),Sheep and goats,,head/ha,,,"FAO, Statistics Division (FAOSTAT)",processed,,,,,,"sheep and goats, production"
QA.STCK.SG.HD.GR11,Sheep and goats annual growth (percent),Sheep and goats,,percent,,,"FAO, Statistics Division (FAOSTAT)",processed,,,,,,"sheep and goats, production"
QA.STCK.PB.HD.NO,Poultry birds (heads),Poultry birds,thousand,heads,Domesticated birds for commercial use.,FAO,"FAO, Statistics Division (FAOSTAT)",raw,QA,5112,2029,,,"poultry birds, production"
QA.STCK.PB.HD.SHW,"Poultry, share of world",Poultry birds,,percent,,,"FAO, Statistics Division",processed,,,,,,"poultry birds, production"
QA.STCK.PB.HD.SHL,Poultry birds per ha of agricultural area (head/ha),Poultry birds,,head/ha,,,"FAO, Statistics Division (FAOSTAT)",processed,,,,,,"poultry birds, production"
QA.STCK.PB.HD.GR11,Poultry birds annual growth (percent),Poultry birds,,percent,,,"FAO, Statistics Division (FAOSTAT)",processed,,,,,,"poultry birds, production"
QA.STCK.PIG.HD.NO,Pigs (heads),Pigs,,heads,Domestic pig (Sus domestica); wild boar (Sus scrofa). See 866. Excludes non-domesticated wild boars.,FAO,"FAO, Statistics Division (FAOSTAT)",raw,QA,5111,1034,,,"pigs, production"
QA.STCK.PIG.HD.SHW,"Pigs, share of world",Pigs,,percent,,,"FAO, Statistics Division",processed,,,,,,"pigs, production"
QA.STCK.PIG.HD.SHL,Pigs per ha of agricultural area (head/ha),Pigs,,heads/ha,,,"FAO, Statistics Division (FAOSTAT)",processed,,,,,,"pigs, production"
QA.STCK.PIG.HD.GR11,Pigs annual growth (percent),Pigs,,percent,,,"FAO, Statistics Division (FAOSTAT)",processed,,,,,,"pigs, production"
QA.STCK.CHI.HD.NO,Chickens (heads),Chickens,thousand,heads,See 'Chickens' and 'Production'.,FAO,"FAO, Statistics Division (FAOSTAT)",raw,QA,5112,1057,,,"chickens, production"
QA.STCK.DU.HD.NO,Ducks (heads),Ducks,thousand,heads,,FAO,"FAO, Statistics Division (FAOSTAT)",raw,QA,5112,1068,,,"ducks, production"
QA.STCK.GGF.HD.NO,Geese and guinea fowls (heads),Geese and guinea fowls,thousand,heads,,FAO,"FAO, Statistics Division (FAOSTAT)",raw,QA,5112,1072,,,"geese and guinea fowls, production"
QA.STCK.TU.HD.NO,Turkeys (heads),Turkeys,thousand,heads,,FAO,"FAO, Statistics Division (FAOSTAT)",raw,QA,5112,1079,,,"turkeys, production"
QD.PRD.BOB.TN.NO,Beer of barley (tonnes),Beer of barley,,tonnes,See 'Beer of barley' and 'Crop production'.,FAO,"FAO, Statistics Division (FAOSTAT)",raw,QD,5510,51,,,"beer of barley, production"
QD.PRD.CCO.TN.NO,Coconut (copra) oil (tonnes),Coconut (copra) oil,,tonnes,See 'Coconut (copra) oil' and 'Crop production'.,FAO,"FAO, Statistics Division (FAOSTAT)",raw,QD,5510,252,,,"coconut (copra) oil, production"
QD.PRD.CL.TN.NO,Cotton lint (tonnes),Cotton lint,,tonnes,See 'Cotton lint' and 'Crop production'.,FAO,"FAO, Statistics Division (FAOSTAT)",raw,QD,5510,767,,,"cotton lint, production"
QD.PRD.CSO.TN.NO,Cottonseed oil (tonnes),Cottonseed oil,,tonnes,"Default composition:  Oil, cottonseed",FAO,"FAO, Statistics Division (FAOSTAT)",raw,QD,5510,331,,,"cottonseed oil, production"
QD.PRD.CS.TN.NO,Cottonseed (tonnes),Cottonseed,,tonnes,See 'Cottonseed' and 'Crop production'.,FAO,"FAO, Statistics Division (FAOSTAT)",raw,QD,5510,329,,,"cottonseed, production"
QD.PRD.GNO.TN.NO,Groundnut oil (tonnes),Groundnut oil,,tonnes,"Default composition:  Oil, groundnut",FAO,"FAO, Statistics Division (FAOSTAT)",raw,QD,5510,244,,,"groundnut oil, production"
QD.PRD.LSO.TN.NO,Linseed oil (tonnes),Linseed oil,,tonnes,See 'Oil crops'.,FAO,"FAO, Statistics Division (FAOSTAT)",raw,QD,5510,334,,,"linseed oil, production"
QD.PRD.MO.TN.NO,Maize oil (tonnes),Maize oil,,tonnes,"See 'Oil, maize' and 'Crop production'.",FAO,"FAO, Statistics Division (FAOSTAT)",raw,QD,5510,60,,,"maize oil, production"
QD.PRD.MS.TN.NO,Margrine short (tonnes),Margrine short,,tonnes,See 'Margrine short' and 'Crop production'.,FAO,"FAO, Statistics Division (FAOSTAT)",raw,QD,5510,1242,,,"margrine short, production"
QD.PRD.ML.TN.NO,Molasses (tonnes),Molasses,,tonnes,See 'Molasses' and 'Crop production'.,FAO,"FAO, Statistics Division (FAOSTAT)",raw,QD,5510,165,,,"molasses, production"
QD.PRD.OOV.TN.NO,"Olive oil, virgin (tonnes)","Olive oil, virgin",,tonnes,"See 'Olive oil, virgin' and 'Crop production'.",FAO,"FAO, Statistics Division (FAOSTAT)",raw,QD,5510,261,,,"olive oil, production"
QD.PRD.PKO.TN.NO,Palm kernel oil (tonnes),Palm kernel oil,,tonnes,See 'Palm kernel oil' and 'Crop production'.,FAO,"FAO, Statistics Division (FAOSTAT)",raw,QD,5510,258,,,"palm kernel oil, production"
QD.PRD.PK.TN.NO,Palm kernels (tonnes),Palm kernels,,tonnes,See 'Palm kernels' and 'Crop production'.,FAO,"FAO, Statistics Division (FAOSTAT)",raw,QD,5510,256,,,"palm kernels, production"
QD.PRD.PO.TN.NO,Palm oil (tonnes),Palm oil,,tonnes,"See 'Oil, palm' and 'Crop production'.",FAO,"FAO, Statistics Division (FAOSTAT)",raw,QD,5510,257,,,"palm oil, production"
QD.PRD.RO.TN.NO,Rapeseed oil (tonnes),Rapeseed oil,,tonnes,See 'Rape  and Mustard oil'.,FAO,"FAO, Statistics Division (FAOSTAT)",raw,QD,5510,271,,,"rapeseed oil, production"
QD.PRD.SAFO.TN.NO,Safflower oil (tonnes),Safflower oil,,tonnes,See 'Oilcrops'.,FAO,"FAO, Statistics Division (FAOSTAT)",raw,QD,5510,281,,,"safflower oil, production"
QD.PRD.SO.TN.NO,Sesame oil (tonnes),Sesame oil,,tonnes,"Default composition:  Oil, sesame",FAO,"FAO, Statistics Division (FAOSTAT)",raw,QD,5510,290,,,"sesame oil, production"
QD.PRD.SBO.TN.NO,Soybean oil (tonnes),Soybean oil,,tonnes,See 'Soybean oil' and 'Crop production'.,FAO,"FAO, Statistics Division (FAOSTAT)",raw,QD,5510,237,,,"soybean oil, production"
QD.PRD.SRC.TN.NO,Sugar raw centrifugal (tonnes),Sugar raw centrifugal,,tonnes,See 'Sugar (Raw Equivalent)' and 'Crop production'.,FAO,"FAO, Statistics Division (FAOSTAT)",raw,QD,5510,162,,,"sugar raw centrifugal, production"
