DATA_KEY,SERIES_NAME,SERIES_NAME_SHORT,QUANTITY,ORIG_UNIT,INFO,OWNER,SOURCE,DATA_TYPE,SQL_DOMAIN_CODE,SQL_ELEMENT_CODE,SQL_ITEM_CODE,WDINAME,COMMENTS,TOPIC
DP.CON.REF.PPL.NO,"Total refugees, total",Refugees,,people,"In UNHCR statistics, refugees include individuals recognized under the 1951 Convention relating to the Status of Refugees; its 1967 Protocol; the 1969 OAU Convention Governing the Specific Aspects of Refugee Problems in Africa; those recognized in accordance with the UNHCR Statute; individuals granted complementary forms of protection; or, those enjoying 'temporary protection'. The 2007 refugee population category also includes people in a refugee-like situation, most of who were previously included in the Others of concern group. This sub-category is descriptive in nature and includes groups of persons who are outside their country or territory of origin and who face protection risks similar to those of refugees, but for whom refugee status has, for practical or other reasons, not been ascertained.",UNHCR,Statistical Online Population Database ,raw,,,,,,"refugees, unhcr"
DP.CON.IDP.PPL.NO,"Internally displaced persons, total",Internally displaced,,people,"Internally Displaced Persons (IDPs) are people or groups of individuals who have been forced to leave their homes or places of habitual residence, in particular as a result of, or in order to avoid the effects of armed conflict, situations of generalized violence, violations of human rights or natural- or human-made disasters, and who have not crossed an international border. For purposes of UNHCR's statistics, this population only includes conflict-generated IDPs to whom the Office extends protection and/or assistance. As such, UNHCR statistics do not provide a comprehensive picture of global internal displacement. Moreover, UNHCR's IDP statistics are not necessarily representative of the entire IDP population in a given country but are exclusively limited to the ones who are protected and/or assisted by the Office. For global IDP estimates, consult the Internal Displacement Monitoring Centre (IDMC) of the Norwegian Refugee Council (NRC) website. The 2007 IDP population category also includes people in IDP-like situations. This sub-category is descriptive in nature and includes groups of persons who are inside their country of nationality or habitual residence and who face protection risks similar to those of IDPs but who, for practical or other reasons, could not be reported as such.",UNHCR,Statistical Online Population Database ,raw,,,,,,"internally displaced persons, unhcr"
DP.CON.O.PPL.NO,"Others and stateless, total",Others,,people,"Population of concern to UNHCR, others and stateless.",UNHCR,Statistical Online Population Database ,raw,,,,,,"others and stateless, unhcr"
DP.CON.AS.PPL.NO,"Asylum seekers, total",Asylum seekers,,people,"Asylum-seekers are individuals who have sought international protection and whose claims for refugee status have not yet been determined, irrespective of when they may have been lodged.",UNHCR,Statistical Online Population Database ,raw,,,,,,"asylum seekers, unhcr"
DP.CON.RETREF.PPL.NO,"Returned refugees, total",Returned refugees,,people,Returned refugees are former refugees who have returned to their country of origin spontaneously or in an organised fashion but are yet to be fully integrated. Such return would normally only take place in conditions of safety and dignity.,UNHCR,Statistical Online Population Database ,raw,,,,,,"returned refugees, unhcr"
DP.CON.RETIDP.PPL.NO,"Returned internally displaced people, total",Returned IDPs,,people,Returned IDPs refer to those IDPs who were beneficiaries of UNHCR's protection and assistance activities and who returned to their areas of origin or habitual residence during the year.,UNHCR,Statistical Online Population Database ,raw,,,,,,returned IDPs unhcr
DP.CON.SL.PPL.NO,"Stateless, total",Stateless,,people,"Stateless persons are defined under international law as persons who are not considered as nationals by any State under the operation of its law. In other words, they do not possess the nationality of any State. UNHCR statistics refer to persons who fall under the agency's statelessness mandate because they are stateless according to this international definition, but data from some countries may also include persons with undetermined nationality.",UNHCR,Statistical Online Population Database ,raw,,,,,,"stateless, unhcr"
FI.PRD.CAPT.TN.NO,Capture fish production (tonnes),Capture fish poduction,,tonnes,"Capture fishery is defined as the hunting, collecting and gathering activities directed at removing or collecting live wild aquatic organisms. The capture production statistics here indicates the nominal catches of aquatic organisms, killed, caught, trapped or collected for all commercial, industrial, recreational and subsistence purposes in live weight equivalent. Data included here covers capture production of fish, molluscs, crustaceans and miscellaneous aquatic animals but excluding production for marine mammals, crocodiles, corals, pearls, sponges and aquatic plants.",FAO,Fisheries and Aquaculture Department (Fishery and Aquaculture statistics),raw,,,,,,"fish, capture production"
FI.PRD.CAPT.TN.GR11,Capture fish production annual growth (percent),Capture fish poduction,,percent,,,Fisheries and Aquaculture Department (Fishery and Aquaculture statistics),processed,,,,,,"fish, capture production"
FI.PRD.CAPT.TN.SH,Capture fish production per capita (tonne/cap),Capture fish food supply,,tonne/cap,,,Fisheries and Aquaculture Department (Fishery and Aquaculture statistics),processed,,,,,,"fish, capture production"
FI.PRD.CAPT.TN.SHW,"Capture fish production, share of world production (percent)",Capture,,percent,,,Fisheries and Aquaculture Department (Fishery and Aquaculture statistics),processed,,,,,,"fish, capture production"
FI.PRD.CAPTIN.TN.NO,Capture fish production inland (tonnes),Capture fish inland poduction,,tonnes,Capture fishery production from inland areas.,FAO,Fisheries and Aquaculture Department (Fishery and Aquaculture statistics),raw,,,,,,"fish, capture production"
FI.PRD.CAPTMA.TN.NO,Capture fish production marine (tonnes),Capture fish marine poduction,,tonnes,Capture fishery production from marine areas.,FAO,Fisheries and Aquaculture Department (Fishery and Aquaculture statistics),raw,,,,,,"fish, capture production"
FI.PRD.AQ.TN.NO,Aquaculture fish production (tonnes),Aquaculture fish poduction,,tonnes,"Aquaculture is defined as the farming of aquatic organisms. Farming implies some form of intervention in the rearing process to enhance production, such as regular stocking, feeding, protection from predators, etc. Farming also implies individual or corporate ownership of the stock being cultivated. For statistical purposes, aquatic organisms which are harvested by an individual or corporate body which has owned them throughout their rearing period contribute to aquaculture, while aquatic organisms which are exploitable by the public as a common property resource, with or without appropriate licenses, are the harvest of fisheries. In the case of capture-based aquaculture, only the incremental growth (or weight gain) in captivity, could and should be reported as the production from aquaculture. Data included here covers an aquaculture production of fish, molluscs, crustaceans and miscellaneous aquatic animals but excluding production for marine mammals, crocodiles, corals, pearls, sponges and aquatic plants.  ",FAO,Fisheries and Aquaculture Department (Fishery and Aquaculture statistics),raw,,,,,,"fish, aquaculture production"
FI.PRD.AQ.TN.GR11,Aquaculture fish production annual growth (percent),Aquaculture fish poduction,,percent,,,Fisheries and Aquaculture Department (Fishery and Aquaculture statistics),processed,,,,,,"fish, aquaculture production"
FI.PRD.AQ.TN.SH,Aquaculture fish production per capita (tonne/cap),Aquaculture fish food supply,,tonne/cap,,,Fisheries and Aquaculture Department (Fishery and Aquaculture statistics),processed,,,,,,"fish, aquaculture production"
FI.PRD.AQ.TN.SHW,"Aquaculture fish production, share of world production (percent)",Aquaculture,,percent,,,Fisheries and Aquaculture Department (Fishery and Aquaculture statistics),processed,,,,,,"fish, aquaculture production"
FI.PRD.AQIN.TN.NO,Aquaculture fish production inland (tonnes),Aquaculture fish inland poduction,,tonnes,Aquaculture production from inland areas.,FAO,Fisheries and Aquaculture Department (Fishery and Aquaculture statistics),raw,,,,,,"fish, aquaculture production"
FI.PRD.AQMA.TN.NO,Aquaculture fish production marine (tonnes),Aquaculture fish marine poduction,,tonnes,Aquaculture production from marine areas.,FAO,Fisheries and Aquaculture Department (Fishery and Aquaculture statistics),raw,,,,,,"fish, aquaculture production"
FI.PRD.CAPTCPH.TN.NO,"Capture fish production, cephalopods fresh (tonnes)",Cephalopods,,tonnes,See 'Capture fish production (tonnes)'.,FAO,Fisheries and Aquaculture Department (Fishery and Aquaculture statistics),raw,,,,,,
FI.PRD.CAPTCPH.TN.SH,"Capture cephalopods fresh, share of total capture fish production (tonnes)",Cephalopods,,percent,,,Fisheries and Aquaculture Department (Fishery and Aquaculture statistics),processed,,,,,,
FI.PRD.CAPTMEC.TN.NO,"Capture fish production, molluscs excl cephalopods fresh (tonnes)",Molluscs excl cephalopods,,tonnes,See 'Capture fish production (tonnes)'.,FAO,Fisheries and Aquaculture Department (Fishery and Aquaculture statistics),raw,,,,,,
FI.PRD.CAPTMEC.TN.SH,"Capture  molluscs excl cephalopods, share of total capture fish production (tonnes)",Molluscs excl cephalopods,,percent,,,Fisheries and Aquaculture Department (Fishery and Aquaculture statistics),processed,,,,,,
FI.PRD.CAPTCRS.TN.NO,"Capture fish production, crustaceans fresh (tonnes)",Crustaceans,,tonnes,See 'Capture fish production (tonnes)'.,FAO,Fisheries and Aquaculture Department (Fishery and Aquaculture statistics),raw,,,,,,
FI.PRD.CAPTCRS.TN.SH,"Capture crustaceans fresh, share of total capture fish production (tonnes)",Crustaceans,,percent,,,Fisheries and Aquaculture Department (Fishery and Aquaculture statistics),processed,,,,,,
FI.PRD.CAPTFDF.TN.NO,"Capture fish production, freshwater and diadromous fresh (tonnes)",Freshwater and diadromous fish,,tonnes,See 'Capture fish production (tonnes)'.,FAO,Fisheries and Aquaculture Department (Fishery and Aquaculture statistics),raw,,,,,,
FI.PRD.CAPTFDF.TN.SH,"Capture freshwater and diadromous fish fresh, share of total capture fish production (tonnes)",Freshwater and diadromous fish,,percent,,,Fisheries and Aquaculture Department (Fishery and Aquaculture statistics),processed,,,,,,
FI.PRD.CAPTMFNF.TN.NO,"Capture fish production, marine fish nes fresh (tonnes)",Marine fish,,tonnes,See 'Capture fish production (tonnes)'.,FAO,Fisheries and Aquaculture Department (Fishery and Aquaculture statistics),raw,,,,,,
FI.PRD.CAPTMFNF.TN.SH,"Capture marine fish nes fresh, share of total capture fish production (tonnes)",Marine fish,,percent,,,Fisheries and Aquaculture Department (Fishery and Aquaculture statistics),processed,,,,,,
FI.PRD.CAPTOTH.TN.NO,"Capture fish production, other (tonnes)",Others,,tonnes,See 'Capture fish production (tonnes)'.,FAO,Fisheries and Aquaculture Department (Fishery and Aquaculture statistics),raw,,,,,,
FI.PRD.CAPTOTH.TN.SH,"Capture others, share of total capture fish production (tonnes)",Others,,percent,,,Fisheries and Aquaculture Department (Fishery and Aquaculture statistics),processed,,,,,,
FI.PRD.AQCPH.TN.NO,"Aquaculture fish production, cephalopods fresh (tonnes)",Cephalopods,,tonnes,See 'Aquaculture fish production (tonnes)'.,FAO,Fisheries and Aquaculture Department (Fishery and Aquaculture statistics),raw,,,,,,
FI.PRD.AQCPH.TN.SH,"Aquaculture cephalopods fresh, share of total Aquaculture fish production (tonnes)",Cephalopods,,percent,,,Fisheries and Aquaculture Department (Fishery and Aquaculture statistics),processed,,,,,,
FI.PRD.AQMEC.TN.NO,"Aquaculture fish production, molluscs excl cephalopods fresh (tonnes)",Molluscs excl cephalopods,,tonnes,See 'Aquaculture fish production (tonnes)'.,FAO,Fisheries and Aquaculture Department (Fishery and Aquaculture statistics),raw,,,,,,
FI.PRD.AQMEC.TN.SH,"Aquaculture  molluscs excl cephalopods, share of total Aquaculture fish production (tonnes)",Molluscs excl cephalopods,,percent,,,Fisheries and Aquaculture Department (Fishery and Aquaculture statistics),processed,,,,,,
FI.PRD.AQCRS.TN.NO,"Aquaculture fish production, crustaceans fresh (tonnes)",Crustaceans,,tonnes,See 'Aquaculture fish production (tonnes)'.,FAO,Fisheries and Aquaculture Department (Fishery and Aquaculture statistics),raw,,,,,,
FI.PRD.AQCRS.TN.SH,"Aquaculture crustaceans fresh, share of total Aquaculture fish production (tonnes)",Crustaceans,,percent,,,Fisheries and Aquaculture Department (Fishery and Aquaculture statistics),processed,,,,,,
FI.PRD.AQFDF.TN.NO,"Aquaculture fish production, freshwater and diadromous fresh (tonnes)",Freshwater and diadromous fish,,tonnes,See 'Aquaculture fish production (tonnes)'.,FAO,Fisheries and Aquaculture Department (Fishery and Aquaculture statistics),raw,,,,,,
FI.PRD.AQFDF.TN.SH,"Aquaculture freshwater and diadromous fish fresh, share of total Aquaculture fish production (tonnes)",Freshwater and diadromous fish,,percent,,,Fisheries and Aquaculture Department (Fishery and Aquaculture statistics),processed,,,,,,
FI.PRD.AQMFNF.TN.NO,"Aquaculture fish production, marine fish nes fresh (tonnes)",Marine fish,,tonnes,See 'Aquaculture fish production (tonnes)'.,FAO,Fisheries and Aquaculture Department (Fishery and Aquaculture statistics),raw,,,,,,
FI.PRD.AQMFNF.TN.SH,"Aquaculture marine fish nes fresh, share of total Aquaculture fish production (tonnes)",Marine fish,,percent,,,Fisheries and Aquaculture Department (Fishery and Aquaculture statistics),processed,,,,,,
FI.PRD.AQOTH.TN.NO,"Aquaculture fish production, other (tonnes)",Others,,tonnes,See 'Aquaculture fish production (tonnes)'.,FAO,Fisheries and Aquaculture Department (Fishery and Aquaculture statistics),raw,,,,,,
FI.PRD.AQOTH.TN.SH,"Aquaculture others, share of total Aquaculture fish production (tonnes)",Others,,percent,,,Fisheries and Aquaculture Department (Fishery and Aquaculture statistics),processed,,,,,,
FI.EXVAL.FISH.USD.NO,Exports of fish (US$),Fish exports,,US$,"Value of exports of fish in current US$ (data reported include fish, molluscs, crustaceans, and miscellaneous aquatic animals but excluding marine mammals, crocodiles, corals, pearls, sponges and aquatic plants, miscellaneous aquatic animal products and fish waste).",FAO,Fisheries and Aquaculture Department (Fishery and Aquaculture statistics),raw,,,,,,"fish, export"
FI.EXVAL.FISH.USD.SH,Exports of fish (real 2005 US$),Fish exports,,US$,,,Fisheries and Aquaculture Department (Fishery and Aquaculture statistics),processed,,,,,,"fish, export"
FI.IMVAL.FISH.USD.NO,Imports of fish (US$),Fish imports,,US$,"Value of imports of fish in current US$ (data reported include fish, molluscs, crustaceans, and miscellaneous aquatic animals but excluding production for marine mammals, crocodiles, corals, pearls, sponges and aquatic plants, miscellaneous aquatic animal products and fish waste).",FAO,Fisheries and Aquaculture Department (Fishery and Aquaculture statistics),raw,,,,,,"fish, import"
FI.IMVAL.FISH.USD.SH,Imports of fish (real 2005 US$),Fish imports,,US$,,,Fisheries and Aquaculture Department (Fishery and Aquaculture statistics),processed,,,,,,"fish, import"
FI.NETVAL.FISH.USD.NO,Net trade of fish (US$),Fish imports,,US$,,,Fisheries and Aquaculture Department (Fishery and Aquaculture statistics),processed,,,,,,
FI.NETVAL.FISH.USD.SH,Net trade of fish (constant 2005 US$),Fish imports,,constant 2005 US$,,,Fisheries and Aquaculture Department (Fishery and Aquaculture statistics),processed,,,,,,
EN.BIR.THRD.NO,"Bird species, threatened",Bird species,,species,"Birds are listed for countries included within their breeding or wintering ranges. Threatened species are the number of species classified by the IUCN as endangered, vulnerable, rare, indeterminate, out of danger, or insufficiently known.","United Nations Environmental Program and the World Conservation Monitoring Centre, and International Union for Conservation of Nature, Red List of Threatened Species.",World Bank (WDI),raw,,,,EN.BIR.THRD.NO,,
EN.FSH.THRD.NO,"Fish species, threatened",Fish species,,species,"Fish species are based on Froese, R. and Pauly, D. (eds). 2008. Threatened species are the number of species classified by the IUCN as endangered, vulnerable, rare, indeterminate, out of danger, or insufficiently known.","Froese, R. and Pauly, D. (eds). 2008. FishBase database, www.fishbase.org.",World Bank (WDI),raw,,,,EN.FSH.THRD.NO,,
EN.MAM.THRD.NO,"Mammal species, threatened",Mammal species,,species,"Mammal species are mammals excluding whales and porpoises. Threatened species are the number of species classified by the IUCN as endangered, vulnerable, rare, indeterminate, out of danger, or insufficiently known.","United Nations Environmental Program and the World Conservation Monitoring Centre, and International Union for Conservation of Nature, Red List of Threatened Species.",World Bank (WDI),raw,,,,EN.MAM.THRD.NO,,
EN.HPT.THRD.NO,"Plant species (higher), threatened",Plant species,,species,"Higher plants are native vascular plant species. Threatened species are the number of species classified by the IUCN as endangered, vulnerable, rare, indeterminate, out of danger, or insufficiently known.","United Nations Environmental Program and the World Conservation Monitoring Centre, and International Union for Conservation of Nature, Red List of Threatened Species.",World Bank (WDI),raw,,,,EN.HPT.THRD.NO,,
ER.LND.PTLD.ZS,Terrestrial protected areas (share of total land area),Terrestrial protected areas,,percent,"Terrestrial protected areas are totally or partially protected areas of at least 1,000 hectares that are designated by national authorities as scientific reserves with limited public access, national parks, natural monuments, nature reserves or wildlife sanctuaries, protected landscapes, and areas managed mainly for sustainable use. Marine areas, unclassified areas, littoral (intertidal) areas, and sites protected under local or provincial law are excluded.","United Nations Environmental Program and the World Conservation Monitoring Centre, as compiled by the World Resources Institute, based on data from national authorities, national legislation and international agreements.",World Bank (WDI),raw,,,,ER.LND.PTLD.ZS,,
ER.MRN.PTMR.ZS,Marine protected areas (share of territorial waters),Marine protected areas,,percent,Marine protected areas are areas of intertidal or subtidal terrain--and overlying water and associated flora and fauna and historical and cultural features--that have been reserved by law or other effective means to protect part or all of the enclosed environment.,"United Nations Environmental Program and the World Conservation Monitoring Centre, as compiled by the World Resources Institute, based on data from national authorities, national legislation and international agreements.",World Bank (WDI),raw,,,,ER.MRN.PTMR.ZS,,
EE.BOD.TOTL.KG,Organic water pollutant (BOD) emissions (kg per day),,,kg/day,"Emissions of organic water pollutants are measured by biochemical oxygen demand, which refers to the amount of oxygen that bacteria in water will consume in breaking down waste. This is a standard water-treatment test for the presence of organic pollutants.","1998 study by Hemamala Hettige, Muthukumara Mani, and David Wheeler, ""Industrial Pollution in Economic Development: Kuznets Revisited"" (available at www.worldbank.org/nipr). The data were updated by the World Bank's Development Research Group using the same methodology as the initial study.",World Bank (WDI),raw,,,,EE.BOD.TOTL.KG,,
EE.BOD.WRKR.KG,Organic water pollutant (BOD) emissions (kg per day per worker),,,kg/day/worker,"Emissions per worker are total emissions of organic water pollutants divided by the number of industrial workers. Organic water pollutants are measured by biochemical oxygen demand, which refers to the amount of oxygen that bacteria in water will consume in breaking down waste. This is a standard water-treatment test for the presence of organic pollutants.",World Bank and UNIDO's industry database.,World Bank (WDI),raw,,,,EE.BOD.WRKR.KG,,
EE.BOD.CHEM.ZS,"Water pollution, chemical industry (share of total BOD emissions)",,,percent,"Industry shares of emissions of organic water pollutants refer to emissions from manufacturing activities as defined by two-digit divisions of the International Standard Industrial Classification (ISIC), revision 2: chemicals (35). Emissions of organic water pollutants are measured by biochemical oxygen demand, which refers to the amount of oxygen that bacteria in water will consume in breaking down waste. This is a standard water-treatment test for the presence of organic pollutants.","1998 study by Hemamala Hettige, Muthukumara Mani, and David Wheeler, ""Industrial Pollution in Economic Development: Kuznets Revisited"" (available at www.worldbank.org/nipr). The data were updated by the World Bank's Development Research Group using the same methodology as the initial study.",World Bank (WDI),raw,,,,EE.BOD.CHEM.ZS,,
EE.BOD.CGLS.ZS,"Water pollution, clay and glass industry (share of total BOD emissions)",,,percent,"See 'Water pollution, chemical industry (% of total BOD emissions)'.","See 'Water pollution, chemical industry (% of total BOD emissions)'.",World Bank (WDI),raw,,,,EE.BOD.CGLS.ZS,,
EE.BOD.FOOD.ZS,"Water pollution, food industry (share of total BOD emissions)",,,percent,"See 'Water pollution, chemical industry (% of total BOD emissions)'.","See 'Water pollution, chemical industry (% of total BOD emissions)'.",World Bank (WDI),raw,,,,EE.BOD.FOOD.ZS,,
EE.BOD.MTAL.ZS,"Water pollution, metal industry (share of total BOD emissions)",,,percent,"See 'Water pollution, chemical industry (% of total BOD emissions)'.","See 'Water pollution, chemical industry (% of total BOD emissions)'.",World Bank (WDI),raw,,,,EE.BOD.MTAL.ZS,,
EE.BOD.OTHR.ZS,"Water pollution, other industry (share of total BOD emissions)",,,percent,"See 'Water pollution, chemical industry (% of total BOD emissions)'.","See 'Water pollution, chemical industry (% of total BOD emissions)'.",World Bank (WDI),raw,,,,EE.BOD.OTHR.ZS,,
EE.BOD.PAPR.ZS,"Water pollution, paper and pulp industry (share of total BOD emissions)",,,percent,"See 'Water pollution, chemical industry (% of total BOD emissions)'.","See 'Water pollution, chemical industry (% of total BOD emissions)'.",World Bank (WDI),raw,,,,EE.BOD.PAPR.ZS,,
EE.BOD.TXTL.ZS,"Water pollution, textile industry (share of total BOD emissions)",,,percent,"See 'Water pollution, chemical industry (% of total BOD emissions)'.","See 'Water pollution, chemical industry (% of total BOD emissions)'.",World Bank (WDI),raw,,,,EE.BOD.TXTL.ZS,,
EE.BOD.WOOD.ZS,"Water pollution, wood industry (share of total BOD emissions)",,,percent,"See 'Water pollution, chemical industry (% of total BOD emissions)'.","See 'Water pollution, chemical industry (% of total BOD emissions)'.",World Bank (WDI),raw,,,,EE.BOD.WOOD.ZS,,
FB.FS.GTCPE.KCD.NO,Food supply in crops primary equivalent (kcal/cap/day),Food supply in crops primary equivalent,,kcal/cap/day,Food supply in crops primary equivalent.,FAO,"FAO, Statistics Division (FAOSTAT)",raw,FB,664,2901,,,production
FB.PSQ.GTCPE.GCD.NO,Protein supply quantity in crops primary equivalent (g/cap/day),Protein supply quantity in crops primary equivalent,,g/cap/day,Protein supply quantity in crops primary equivalent.,FAO,"FAO, Statistics Division (FAOSTAT)",raw,FB,674,2901,,,production
FB.FSQ.GTCPE.GCD.NO,Fat supply quantity in crops primary equivalent (g/cap/day),Fat supply quantity in crops primary equivalent,,g/cap/day,Fat supply quantity in crops primary equivalent.,FAO,"FAO, Statistics Division (FAOSTAT)",raw,FB,684,2901,,,production
CTA.TOTDON.COM.LCU.NO,Credit to agriculture (current LCU),,,current LCU,Credit to agriculture.,FAO,"FAO, Statistics Division",raw,,,,,,credit to agriculture
CTA.TOTDON.COM.LCU.SH,"Credit to agriculture, share of agriculture value added (percent)",,,percent,Credit to agriculture.,FAO,"FAO, Statistics Division",raw,,,,,,credit to agriculture
GFRA.TOT.TOT.HA.NO,Total forest (ha),,thousand,ha,"Sum of 'Other naturally regenerated forest (ha)', 'Primary forest (ha)', and 'Planted forest (ha)'.",FAO,Global Forest Resources Assessment,raw,,,,,,global forest resources assessment
GFRA.TOT.ONRF.HA.NO,Other naturally regenerated forest (ha),Other naturally reg. forest,thousand,ha,Naturally regenerated forest is forest predominantly composed of trees established through natural regeneration. Other naturally regenerated forest is forest where there are clearly visible indications of human activities.,FAO,Global Forest Resources Assessment,raw,,,,,,global forest resources assessment
GFRA.TOT.ONRF.HA.SH,"Other naturally regenerated forest, share of total forest (percent)",Other naturally regenerated forest,,percent,,,Global Forest Resources Assessment,processed,,,,,,global forest resources assessment
GFRA.TOT.PF.HA.NO,Primary forest (ha),Primary forest,thousand,ha,"Primary forest is naturally regenerated forest of native species, where there are no clearly visible indications of human activities and the ecological processes are not significantly disturbed.",FAO,Global Forest Resources Assessment,raw,,,,,,global forest resources assessment
GFRA.TOT.PF.HA.SH,"Primary forest, share of total forest (percent)",Primary forest,,percent,,,Global Forest Resources Assessment,processed,,,,,,global forest resources assessment
